{
  "$schema": "https://json-schema.org/draft/2020-12/schema",
  "$id": "https://miyo.tomo/schemas/suggestions-doc.schema.json",
  "title": "Suggestions Document (Reducer Output)",
  "description": "Internal JSON produced by suggestions-reducer.py; orchestrator renders this to the final markdown.",
  "type": "object",
  "required": ["schema_version", "generated", "run_id", "profile", "source_items", "sections"],
  "additionalProperties": false,
  "properties": {
    "schema_version": {"const": "1"},
    "generated": {"type": "string"},
    "run_id": {"type": "string"},
    "profile": {"type": "string"},
    "source_items": {"type": "integer", "minimum": 0},
    "folder_listing_calls": {
      "type": "integer",
      "minimum": 0,
      "description": "Kado round trips this run spent listing destination folders for the name-collision check (spec 034 T6.1). Carried across the process boundary: the cost-history step runs later and has no other way to receive it."
    },
    "distinct_destination_folders": {
      "type": "integer",
      "minimum": 0,
      "description": "How many distinct destination folders produced those listings — the number that tells a busy run apart from a pipeline regression."
    },
    "doc_variant": {
      "type": "string",
      "enum": ["primary", "fan-resolve"],
      "description": "Document variant — primary (normal inbox run) or fan-resolve (XDD 012 force-atomic resolve doc)."
    },
    "conventions": {
      "type": "object",
      "description": "Active profile's resolved vault conventions (spec 028). Additive; suggestion-parser reads markers here, falling back to defaults when absent.",
      "required": ["parent_marker", "peer_marker", "moc_suffix"],
      "additionalProperties": false,
      "properties": {
        "parent_marker": {"type": "string"},
        "peer_marker": {"type": "string"},
        "moc_suffix": {"type": "string"}
      }
    },
    "sections": {
      "type": "array",
      "items": {
        "type": "object",
        "required": ["id", "stem", "item_key", "actions"],
        "additionalProperties": false,
        "properties": {
          "id": {"type": "string", "pattern": "^S[0-9]{2,}$"},
          "stem": {"type": "string"},
          "item_key": {"type": "string", "minLength": 1, "description": "The item's identity: its vault-relative path, verbatim (e.g. '100 Inbox/Places/Dresden.md'). Used for joins, dict keys and set membership — unlike stem, it stays unique across subfolders."},
          "actions": {
            "type": "array",
            "minItems": 1,
            "items": {
              "type": "object",
              "required": ["kind", "rendered_md"],
              "additionalProperties": false,
              "properties": {
                "kind": {"type": "string"},
                "rendered_md": {"type": "string"},
                "suggestion_id": {
                  "type": "string",
                  "pattern": "^S[0-9]{2,}$",
                  "description": "Flat global per-atomic suggestion number (F-41 T1). Present only on create_atomic_note actions."
                },
                "item": {
                  "type": "object",
                  "description": "Full structured per-note item (ADR-026). Present on create_atomic_note actions. The suggestions-wire is a complete mirror projected from this; the JSON-only Pass-2 path rebuilds confirmed_items from it without re-reading the markdown.",
                  "required": ["title", "template", "location", "tags", "suppressed", "force_atomic"],
                  "additionalProperties": false,
                  "properties": {
                    "title": {"type": "string"},
                    "summary": {"type": ["string", "null"], "description": "One-sentence gist of the note (analyst-authored, display only). Null when the analyst emitted none."},
                    "template": {"type": "string"},
                    "location": {"type": "string"},
                    "tags": {"type": "array", "items": {"type": "string"}},
                    "audio_peer": {"type": ["string", "null"]},
                    "attachments": {"type": "array", "items": {"type": "string"}, "description": "Resolved vault-relative attachment paths (spec 031). Optional; absent or empty means none."},
                    "worthiness": {"type": ["number", "null"]},
                    "suppressed": {"type": "boolean", "description": "Sub-worthiness atomic rendered as a light 'kept in inbox' block (#88)."},
                    "force_atomic": {"type": "boolean", "description": "Default state of the Force Atomic Note opt-in."}
                  }
                },
                "candidate_mocs": {
                  "type": "array",
                  "description": "Structured Pass-1 placement anchors per candidate MOC (spec 022/023). Threaded to Pass-2 so suggestion-parser.py can use the LLM-resolved anchor as the apply-time default. Present only on create_atomic_note actions that carry MOC candidates.",
                  "items": {
                    "type": "object",
                    "required": ["path", "anchor"],
                    "additionalProperties": false,
                    "properties": {
                      "path": {"type": "string", "description": "Vault-relative MOC path."},
                      "pre_check": {"type": "boolean", "description": "Pre-checked markdown state for this candidate (ADR-026). Persisted so the suggestions-wire projector can compute selection without re-parsing markdown."},
                      "score": {"type": "number", "description": "Match score (0..1). Fallback selection signal when pre_check is absent (checked when score ≥ 0.5)."},
                      "anchor": {
                        "type": ["object", "null"],
                        "description": "Resolved Pass-1 placement anchor (spec 022/023 item-result anchor shape). Null for a matched-but-unresolved candidate (ADR-026 Hashi flag 1).",
                        "required": ["type", "placement"],
                        "additionalProperties": false,
                        "properties": {
                          "type": {"type": "string", "enum": ["heading", "callout", "line"]},
                          "value": {"type": ["string", "null"]},
                          "placement": {"type": "string", "enum": ["before", "after", "inside"]},
                          "new_section": {"type": ["string", "null"]},
                          "alt_headings": {"type": "array", "items": {"type": "string", "pattern": "^[^\\n\\r]+$"}},
                          "fit_confidence": {"type": ["number", "null"]}
                        }
                      }
                    }
                  }
                }
              }
            }
          }
        }
      }
    },
    "proposed_mocs": {
      "type": "array",
      "items": {
        "type": "object",
        "required": ["topic", "items", "parent"],
        "additionalProperties": false,
        "properties": {
          "topic": {"type": "string"},
          "items": {"type": "array", "items": {"type": "string", "pattern": "^S[0-9]{2,}$"}},
          "parent": {"type": "string"},
          "tags": {"type": "array", "items": {"type": "string"}},
          "name": {"type": "string"},
          "note_titles": {"type": "array", "items": {"type": "string"}},
          "reason": {"type": "string"}
        }
      }
    },
    "daily_notes_updates": {
      "type": "array",
      "items": {
        "type": "object",
        "required": ["daily_note_stem", "exists", "trackers", "log_entries", "log_links"],
        "additionalProperties": false,
        "properties": {
          "daily_note_stem": {"type": "string"},
          "exists": {"type": "boolean"},
          "trackers": {
            "type": "array",
            "items": {
              "type": "object",
              "required": ["field", "value", "reason", "source_stem", "source_section"],
              "additionalProperties": false,
              "properties": {
                "field": {"type": "string"},
                "value": {},
                "reason": {"type": "string"},
                "source_stem": {"type": "string"},
                "source_item_key": {"type": "string", "description": "The source note's identity: its vault-relative path, verbatim (spec 034 ADR-1). Absent on documents produced before spec 034."},
                "source_section": {"type": "string", "pattern": "^S[0-9]{2,}$"}
              }
            }
          },
          "log_entries": {
            "type": "array",
            "items": {
              "type": "object",
              "required": ["content", "reason", "source_stem", "source_section"],
              "additionalProperties": false,
              "properties": {
                "time": {"type": ["string", "null"]},
                "time_source": {"type": ["string", "null"]},
                "position": {"type": ["string", "null"]},
                "content": {"type": "string"},
                "reason": {"type": "string"},
                "source_stem": {"type": "string"},
                "source_item_key": {"type": "string", "description": "The source note's identity: its vault-relative path, verbatim (spec 034 ADR-1). Absent on documents produced before spec 034."},
                "source_section": {"type": "string", "pattern": "^S[0-9]{2,}$"}
              }
            }
          },
          "log_links": {
            "type": "array",
            "items": {
              "type": "object",
              "required": ["target_stem", "reason", "source_stem", "source_section"],
              "additionalProperties": false,
              "properties": {
                "target_stem": {"type": "string"},
                "time": {"type": ["string", "null"]},
                "time_source": {"type": ["string", "null"]},
                "position": {"type": ["string", "null"]},
                "reason": {"type": "string"},
                "source_stem": {"type": "string"},
                "source_item_key": {"type": "string", "description": "The source note's identity: its vault-relative path, verbatim (spec 034 ADR-1). Absent on documents produced before spec 034."},
                "source_section": {"type": "string", "pattern": "^S[0-9]{2,}$"}
              }
            }
          }
        }
      }
    },
    "rendered_daily_updates_md": {"type": "string"},
    "tag_handler_updates": {
      "type": "array",
      "description": "Tag-handler group-result objects (spec 024 T3.3). Each element conforms to tag-handler-group.schema.json. Empty when --tag-handler-groups-dir is absent.",
      "items": {
        "type": "object",
        "required": ["schema_version", "handler", "target_path", "marker", "composed_block", "source_paths"],
        "additionalProperties": false,
        "properties": {
          "schema_version": {"const": "1"},
          "handler": {"type": "string"},
          "target_path": {"type": ["string", "null"]},
          "marker": {"type": "string"},
          "composed_block": {"type": "string"},
          "source_paths": {"type": "array", "items": {"type": "string"}},
          "placement": {"type": "string", "enum": ["inside", "before", "after"]},
          "compose_mode": {"type": "string", "enum": ["llm_directive", "field_template"]}
        }
      }
    },
    "rendered_tag_handler_updates_md": {
      "type": "string",
      "description": "Pre-rendered ## Tag-Handler Updates markdown section (spec 024 T3.3). Empty string when no groups."
    },
    "decision_precedence_note": {"type": "string"},
    "attachments_preamble": {
      "type": "string",
      "description": "Run-level note on the configured attachment-filing destination, rendered once when at least one item carries attachments. Empty string otherwise (spec 031 Phase 5)."
    },
    "needs_attention": {
      "type": "array",
      "items": {
        "type": "object",
        "required": ["stem", "item_key", "error"],
        "additionalProperties": false,
        "properties": {
          "stem": {"type": "string"},
          "item_key": {"type": "string", "minLength": 1, "description": "The item's identity: its vault-relative path, verbatim (e.g. '100 Inbox/Places/Dresden.md'). Used for joins, dict keys and set membership — unlike stem, it stays unique across subfolders."},
          "error": {"type": "string"}
        }
      }
    },
    "attachment_conflicts": {
      "type": "array",
      "description": "Attachments whose computed vault destination is already occupied (spec 037 T1.2, PRD F1). Absent — not an empty array — when the run has none, so a conflict-free run stays byte-identical to a pre-spec-037 document.",
      "items": {
        "type": "object",
        "required": ["source", "destination", "same_file", "owner_source_items", "proposed_name", "proposed_dir"],
        "additionalProperties": false,
        "properties": {
          "source": {"type": "string", "description": "The incoming attachment's vault-relative source path."},
          "destination": {"type": "string", "description": "The computed, occupied destination (via _asset_dest_join — the same helper Pass 2 uses)."},
          "same_file": {
            "type": ["boolean", "null"],
            "description": "Whether source and destination are byte-identical (spec 037 T1.3). null when the comparison could not be made (no Kado client, or a read failed on either side) — never a digest, size, or other content derivative."
          },
          "owner_source_items": {
            "type": "array",
            "items": {"type": "string"},
            "description": "Every note (by item_key) that embeds this attachment."
          },
          "proposed_name": {
            "type": ["string", "null"],
            "description": "The first free basename a rename remedy would use — {stem} ({n}){ext}, mirroring resolve_destination_clashes' scheme with the counter before the extension (spec 037 T2.1, PRD C1). Checked, case-folded, against the asset folder's file listing, the folder-occupancy set, and every proposed_name already handed out this run. null when no candidate is free within 99 attempts; the conflict is still emitted."
          },
          "proposed_dir": {
            "type": ["string", "null"],
            "description": "The vault folder the attachment should land in instead of the occupied destination's folder (spec 039 T3.2, PRD F1). Always null from the reducer: the folder line is rendered pre-filled with dirname(destination) and the owner's edit is read back in Pass 2. Required (like proposed_name) because the reducer always emits it, so a record missing the key is a producer bug."
          },
          "remedy": {
            "type": "string",
            "enum": ["rename", "keep_in_inbox", "ignore"],
            "description": "Filled by suggestion-parser.py (spec 037 T2.4), never by the reducer — this field is absent from every Pass-1 document, including one the owner never opens Pass 2 on. NOT in `required`: requiring it would reject the reducer's own output, which is what this schema validates before a parse ever runs. The parser resolves it exhaustively (PRD Business Rules 2-4, SDD ADR-4) once it does run, so a document that reaches Pass 2's render_actions.py always carries it."
          }
        }
      }
    },
    "rendered_attachment_conflicts_md": {
      "type": "string",
      "description": "Pre-rendered ## Attachment Conflicts markdown section (spec 037 T2.2). Present only alongside attachment_conflicts — a conflict-free run carries neither key, so it stays byte-identical to a pre-spec-037 document."
    }
  }
}
