{
  "schema_version": "1",
  "generated": "2026-09-23T08:47:52Z",
  "run_id": "t037-t2-2-fixture",
  "profile": "miyo",
  "conventions": {
    "parent_marker": "up::",
    "peer_marker": "related::",
    "moc_suffix": " (MOC)"
  },
  "doc_variant": "primary",
  "source_items": 1,
  "sections": [
    {
      "id": "S01",
      "stem": "karte",
      "item_key": "100 Inbox/Scans/karte.md",
      "actions": [
        {
          "kind": "create_atomic_note",
          "rendered_md": "**Source:** [[karte]]\n**Suggested name:** Karte\n**Template:** [[Atomic Note]]    ← change if you want a different template\n**Location:** [[Atlas/202 Notes/]]    ← change if you want a different folder\n**Attachments:** `100 Inbox/Scans/karte.png`\n\n**Why:** atomic-worthiness 85%.\n\n**Decision (atomic note):**\n- [x] Approve\n- [ ] Keep source files\n      (don't delete the original(s) after the note is created — you may still need them)",
          "suggestion_id": "S01",
          "item": {
            "title": "Karte",
            "summary": null,
            "template": "Atomic Note.md",
            "location": "Atlas/202 Notes/",
            "tags": [],
            "audio_peer": null,
            "attachments": [
              "100 Inbox/Scans/karte.png"
            ],
            "worthiness": 0.85,
            "suppressed": false,
            "force_atomic": false
          }
        }
      ]
    }
  ],
  "daily_notes_updates": [],
  "rendered_daily_updates_md": "",
  "decision_precedence_note": "Daily-note decisions (trackers, log entries, log links) live in the Daily Notes Updates block above. Per-item Suggestion sections only cover the atomic-note decision. Use **Force Atomic Note** on a log entry to create a standalone note even when the item was only proposed for the daily log.",
  "attachments_preamble": "Attachments will be filed to `Atlas/290 Assets/295 Attachments/`.",
  "proposed_mocs": [],
  "needs_attention": [],
  "folder_listing_calls": 2,
  "distinct_destination_folders": 2
}
